{
  "asOfDate": "2026-01-01",
  "plan": {
    "startMonth": "2026-01",
    "versions": [
      {
        "id": "plan-1",
        "effectiveFrom": "2026-01",
        "asset": "ETH",
        "monthlyBudgetVnd": 20000000,
        "scheduleDays": [
          3,
          13,
          23
        ],
        "carryPolicy": "CAPPED_CARRY",
        "carryCapMonths": 1
      }
    ]
  },
  "openingPosition": {
    "asOf": "2026-01-01",
    "assets": [
      {
        "symbol": "ETH",
        "qty": 50000000,
        "costUsdt": 1200000000,
        "costVnd": 30000000
      }
    ],
    "usdt": {
      "qty": 200000000,
      "costVnd": 5000000
    },
    "vnd": {
      "qty": 100000000
    },
    "reserveVnd": 0,
    "note": "Số dư tổng hợp SC-01; VND 100 triệu chỉ phục vụ P2P tổng hợp."
  },
  "events": [],
  "expected": {
    "ethQty": 50000000,
    "avgCostUsdt": 2400000000,
    "avgCostVnd": 60000000,
    "investedThisMonthVnd": 0,
    "planInvestedVnd": 0,
    "remainingPlannedBudgetVnd": 20000000,
    "reserveBalanceVnd": 0,
    "nextPlannedDate": "2026-01-03",
    "nextPlannedAmountVnd": 6666667
  },
  "tolerance": {
    "vnd": 0,
    "usdt": 0,
    "qty": 0
  }
}
